{"artifactKind":"content-free-canary-distribution-summary-v1","generatedAt":"2026-07-14T00:31:30.000Z","manifest":{"path":".release-notes/clodex-technical-preview.json","sha256":"2222222222222222222222222222222222222222222222222222222222222222","sourceCommit":"1111111111111111111111111111111111111111"},"observation":{"counters":{"signatureTrustFailures":0,"uniqueInstallations":5},"distributionClosedAt":"2026-07-14T00:31:00.000Z","endedAt":"2026-07-14T00:30:00.000Z","startedAt":"2026-07-13T00:30:00.000Z"},"producer":{"repository":"example-org/clodex-distribution-evidence","runAttempt":1,"runId":4001,"sourceCommit":"4444444444444444444444444444444444444444","sourceRef":"refs/heads/main","workflow":"example-org/clodex-distribution-evidence/.github/workflows/aggregate-canary-distribution.yml","workflowCommit":"4444444444444444444444444444444444444444"},"publication":{"createdAt":"2026-07-13T00:00:00.000Z","releaseId":77,"reportAssetId":101,"reportFileName":"clodex-release-publication.json","reportSha256":"3333333333333333333333333333333333333333333333333333333333333333","repository":"mereyabdenbekuly-ctrl/clodex-ide","sourceCommit":"1111111111111111111111111111111111111111","state":"draft","tag":"v1.16.0-preview.3"},"release":{"channel":"preview","promotionRole":"canary","sourceCommit":"1111111111111111111111111111111111111111","tag":"v1.16.0-preview.3","version":"1.16.0-preview.3"},"schemaVersion":1,"source":{"commit":"1111111111111111111111111111111111111111","ref":"refs/heads/main","repository":"mereyabdenbekuly-ctrl/clodex-ide"}}
